{
  "schemaVersion": "1.0.0",
  "recordType": "COMPLETE_RUN_ENVELOPE",
  "runMetadata": {
    "correlationId": "PO-RUN-SYN-20260713-001",
    "promiseId": "PRM-SYN-001",
    "accountKey": "ACC-SYN-001",
    "source": {
      "system": "SYNTHETIC_FIXTURE",
      "recordType": "VantixControlValueScenario",
      "recordKey": "SCN-SYN-REPORT-ACCESS-001",
      "environment": "SYNTHETIC"
    },
    "timestamps": {
      "startedAt": "2026-07-13T09:00:00+05:30",
      "updatedAt": "2026-07-17T15:12:00+05:30",
      "completedAt": "2026-07-17T15:12:00+05:30"
    },
    "versions": {
      "schemaVersion": "1.0.0",
      "rulesetVersion": "1.0.0",
      "workflowVersion": "0.0.0-foundation-fixture",
      "actionCatalogVersion": "1.0.0",
      "promptVersions": {
        "diagnosis": "1.0.0",
        "critique": "1.0.0"
      }
    },
    "syntheticData": true,
    "operatingMode": "SYNTHETIC_VALIDATION",
    "evidenceRefs": [
      "EVD-SYN-001",
      "EVD-SYN-002",
      "EVD-SYN-003",
      "EVD-SYN-004",
      "EVD-SYN-005",
      "EVD-SYN-006",
      "EVD-SYN-007",
      "EVD-SYN-008",
      "EVD-SYN-009",
      "EVD-SYN-010",
      "EVD-SYN-011",
      "EVD-SYN-012"
    ],
    "modelIdentifiers": {
      "diagnosis": "synthetic-diagnosis-output-fixture-v1",
      "critique": "synthetic-critique-output-fixture-v1"
    },
    "warnings": [
      {
        "code": "SYNTHETIC_FIXTURE_ONLY",
        "message": "This expected run is fabricated for contract and control validation. It is not a real model run, Salesforce action or customer outcome.",
        "occurredAt": "2026-07-13T09:00:00+05:30",
        "evidenceRefs": []
      }
    ],
    "errors": [],
    "executionStatus": "CLOSED"
  },
  "stageStatuses": {
    "capture": "COMPLETED",
    "validation": "PASSED",
    "observation": "COMPLETED",
    "assessment": "COMPLETED",
    "diagnosis": "COMPLETED",
    "critique": "PASSED",
    "policy": "PASSED",
    "approval": "COMPLETED",
    "execution": "COMPLETED",
    "verification": "PASSED",
    "outcome": "COMPLETED",
    "closure": "COMPLETED",
    "reporting": "NOT_STARTED"
  },
  "promiseRecord": {
    "schemaVersion": "1.0.0",
    "recordType": "PROMISE_RECORD",
    "promiseId": "PRM-SYN-001",
    "accountKey": "ACC-SYN-001",
    "idempotencyKey": "IDEMP:PRM-SYN-001:V1",
    "source": {
      "system": "SYNTHETIC_FIXTURE",
      "recordType": "CustomerPromise",
      "recordKey": "SYN-PROMISE-SOURCE-001",
      "environment": "SYNTHETIC"
    },
    "createdAt": "2026-07-13T09:00:00+05:30",
    "updatedAt": "2026-07-17T15:12:00+05:30",
    "syntheticData": true,
    "category": "SALESFORCE_REPORT_ACCESS",
    "promiseStatement": "Restore the authorized customer user's access to the Renewal Readiness Executive Report and obtain confirmation that the customer successfully opened it within five business days.",
    "expectedOutcome": {
      "summary": "Salesforce report access is restored, the customer successfully opens the report, and both events are verified within the promised SLA.",
      "criteria": [
        {
          "criterionId": "CRT-SYN-ACCESS-001",
          "criterionType": "SALESFORCE_ACCESS_RESTORED",
          "description": "A separate system check confirms that the authorized synthetic customer user has access to the report.",
          "requiredEvidenceCategories": [
            "TECHNICAL_VERIFICATION"
          ]
        },
        {
          "criterionId": "CRT-SYN-CUSTOMER-001",
          "criterionType": "CUSTOMER_REPORT_ACCESSED",
          "description": "An authorized customer-use attestation confirms that the synthetic customer successfully opened the report.",
          "requiredEvidenceCategories": [
            "CUSTOMER_USE_CONFIRMATION"
          ]
        },
        {
          "criterionId": "CRT-SYN-SLA-001",
          "criterionType": "PROMISE_WITHIN_SLA",
          "description": "The later of technical verification and customer-use confirmation occurs at or before the calculated due time.",
          "requiredEvidenceCategories": [
            "TECHNICAL_VERIFICATION",
            "CUSTOMER_USE_CONFIRMATION"
          ]
        }
      ]
    },
    "capturedAt": "2026-07-13T09:00:00+05:30",
    "committedAt": "2026-07-13T09:00:00+05:30",
    "dueAt": "2026-07-20T17:00:00+05:30",
    "businessCalendar": {
      "calendarId": "CAL-SYN-IN-WEEKDAY-001",
      "timezone": "Asia/Kolkata",
      "durationBusinessDays": 5,
      "weekendDays": [
        "SATURDAY",
        "SUNDAY"
      ],
      "holidayDates": [],
      "startTreatment": "START_EXCLUSIVE",
      "deadlineTreatment": "END_INCLUSIVE"
    },
    "status": "CLOSED",
    "commitmentOwner": {
      "actorType": "HUMAN",
      "actorId": "SYN-CSM-001",
      "role": "CUSTOMER_SUCCESS_MANAGER",
      "displayName": "Synthetic Customer Success Manager"
    },
    "stakeholderKeys": {
      "csmOwnerKey": "SYN-CSM-001",
      "adminOwnerKey": "SYN-SFADMIN-001",
      "customerUserKey": "SYN-CUST-USER-001",
      "executiveSponsorKey": "SYN-EXEC-SPONSOR-001"
    },
    "impactContext": {
      "arrTier": "TIER_1",
      "renewalSensitive": true,
      "renewalDate": "2026-07-31",
      "strategicStatus": true,
      "contractualExposure": "HIGH",
      "executiveSponsorRequired": true
    },
    "limitations": [
      "All identities and records are synthetic.",
      "The scenario does not prove live Salesforce access behavior."
    ]
  },
  "evidenceRecords": [
    {
      "schemaVersion": "1.0.0",
      "recordType": "EVIDENCE_RECORD",
      "evidenceId": "EVD-SYN-001",
      "promiseId": "PRM-SYN-001",
      "accountKey": "ACC-SYN-001",
      "source": {
        "system": "SYNTHETIC_FIXTURE",
        "recordType": "CommitmentRecord",
        "recordKey": "SYN-COMMITMENT-001",
        "environment": "SYNTHETIC"
      },
      "createdAt": "2026-07-13T09:00:00+05:30",
      "observedAt": "2026-07-13T09:00:00+05:30",
      "validUntil": "2026-07-20T17:00:00+05:30",
      "syntheticData": true,
      "evidenceCategory": "PROMISE_SOURCE",
      "evidenceType": "PROMISE_COMMITMENT",
      "evidenceClass": "SYSTEM_OF_RECORD",
      "strengthClass": "CORROBORATING",
      "trustStatus": "VERIFIED",
      "subject": {
        "subjectType": "PROMISE",
        "subjectKey": "PRM-SYN-001"
      },
      "contentSummary": "Synthetic CRM commitment record captures the exact report-access promise and five-business-day deadline.",
      "factAssertions": [
        {
          "claimKey": "promise.durationBusinessDays",
          "value": 5,
          "unit": "business_days"
        },
        {
          "claimKey": "promise.category",
          "value": "SALESFORCE_REPORT_ACCESS"
        }
      ],
      "verificationMethod": "FIXTURE_ASSERTION",
      "verifiedBy": {
        "actorType": "SYSTEM",
        "actorId": "PO-ORCHESTRATOR-001",
        "role": "N8N_ORCHESTRATOR",
        "displayName": "Vantix Control Value Synthetic Orchestrator"
      },
      "supportsCriteria": [
        "CRT-SYN-ACCESS-001",
        "CRT-SYN-CUSTOMER-001",
        "CRT-SYN-SLA-001"
      ],
      "warnings": []
    },
    {
      "schemaVersion": "1.0.0",
      "recordType": "EVIDENCE_RECORD",
      "evidenceId": "EVD-SYN-002",
      "promiseId": "PRM-SYN-001",
      "accountKey": "ACC-SYN-001",
      "source": {
        "system": "SYNTHETIC_FIXTURE",
        "recordType": "Account",
        "recordKey": "ACC-SYN-001",
        "environment": "SYNTHETIC"
      },
      "createdAt": "2026-07-13T09:01:00+05:30",
      "observedAt": "2026-07-13T09:01:00+05:30",
      "validUntil": "2026-07-20T17:00:00+05:30",
      "syntheticData": true,
      "evidenceCategory": "ACCOUNT_IDENTITY",
      "evidenceType": "ACCOUNT_MASTER",
      "evidenceClass": "SYSTEM_OF_RECORD",
      "strengthClass": "AUTHORITATIVE",
      "trustStatus": "VERIFIED",
      "subject": {
        "subjectType": "ACCOUNT",
        "subjectKey": "ACC-SYN-001"
      },
      "contentSummary": "Fabricated strategic account Meridian Industrial Systems is active and mapped to the promise.",
      "factAssertions": [
        {
          "claimKey": "account.name",
          "value": "Meridian Industrial Systems"
        },
        {
          "claimKey": "account.arrTier",
          "value": "TIER_1"
        },
        {
          "claimKey": "account.strategicStatus",
          "value": true
        }
      ],
      "verificationMethod": "FIXTURE_ASSERTION",
      "verifiedBy": {
        "actorType": "SYSTEM",
        "actorId": "PO-ORCHESTRATOR-001",
        "role": "N8N_ORCHESTRATOR",
        "displayName": "Vantix Control Value Synthetic Orchestrator"
      },
      "supportsCriteria": [],
      "warnings": []
    },
    {
      "schemaVersion": "1.0.0",
      "recordType": "EVIDENCE_RECORD",
      "evidenceId": "EVD-SYN-003",
      "promiseId": "PRM-SYN-001",
      "accountKey": "ACC-SYN-001",
      "source": {
        "system": "SYNTHETIC_FIXTURE",
        "recordType": "RenewalOpportunity",
        "recordKey": "SYN-RENEWAL-001",
        "environment": "SYNTHETIC"
      },
      "createdAt": "2026-07-13T09:02:00+05:30",
      "observedAt": "2026-07-13T09:02:00+05:30",
      "validUntil": "2026-07-31T23:59:59+05:30",
      "syntheticData": true,
      "evidenceCategory": "RENEWAL_CONTEXT",
      "evidenceType": "RENEWAL_RECORD",
      "evidenceClass": "SYSTEM_OF_RECORD",
      "strengthClass": "AUTHORITATIVE",
      "trustStatus": "VERIFIED",
      "subject": {
        "subjectType": "RENEWAL",
        "subjectKey": "SYN-RENEWAL-001"
      },
      "contentSummary": "Synthetic renewal record confirms a 31 July 2026 renewal date and high contractual exposure.",
      "factAssertions": [
        {
          "claimKey": "renewal.date",
          "value": "2026-07-31"
        },
        {
          "claimKey": "renewal.contractualExposure",
          "value": "HIGH"
        }
      ],
      "verificationMethod": "FIXTURE_ASSERTION",
      "verifiedBy": {
        "actorType": "SYSTEM",